,human_baseline_summaries,original_model_summaries,instruct_model_summaries,peft_ia3_model_summaries,peft_lora_model_summaries
395,"Simon tells #Person1# that he joined in a phased retirement scheme which offers retired people work positions from the former company, and he can manage his own time. #Person1# thinks it's good for Simon.",The company is looking for a new employee.,Simon is on a phased retirement scheme.,"Simon has been spending more time with his family and traveled a bit, and he has a six-month break from work after that he applied for project work with the company he used to work for. Simon tells #Person1# about the scheme and the company's work. Simon also has all his old contacts at work, so he knows who to contact to get something done.",Simon tells #Person1# he's on a phased retirement scheme. He has been spending more time with his family and traveled a bit. Simon tells #Person1# about the scheme and how it works. Simon's company gets flexibility.
396,"Rocky doesn't want to dance because no one at the party fits his type, but #Person1# likes different kinds of women from him. Finally, Rocky decides to go home to a TV dinner and his dog, Rusty",:-|,Get out and dance with someone like that at a party.,"#Person2# tells Rocky that #Person2# wants a woman who's affectionate and fulfills #Person2#'s every need. Rocky wants a woman who'll stay home, cook, clean, and watch TV. #Person1# thinks Rocky is the perfect woman. Rocky thinks #Person1#'s idea of the perfect woman is outgoing, caring, and non-judgmental about people's differences.","Rocky wants a woman who's affectionate and fulfills his every need. He wants a woman who'll stay home, cook, clean, and watch the kids, and he wants a woman who's outgoing, caring, and non-judgmental about people's differences. #Person1# thinks he's not going to get married."
397,"Rocky wants a woman who's affectionate and fulfills his every need. #Person1# likes different kinds of women from him. Rocky doesn't mind and plans to go home and spend the night with a TV dinner and his dog, Rusty.",The gang of women are getting ready to go to a party.,Get out and dance with someone like that at a party.,"#Person2# tells Rocky that #Person2# wants a woman who's affectionate and fulfills #Person2#'s every need. Rocky wants a woman who'll stay home, cook, clean, and watch TV. #Person1# thinks Rocky is the perfect woman. Rocky thinks #Person1#'s idea of the perfect woman is outgoing, caring, and non-judgmental about people's differences.","Rocky wants a woman who's affectionate and fulfills his every need. He wants a woman who'll stay home, cook, clean, and watch the kids, and he wants a woman who's outgoing, caring, and non-judgmental about people's differences. #Person1# thinks he's not going to get married."
398,"Rocky has particular requirements and cannot find a suitable woman in the party, so he doesn't want to dance. #Person1# likes different kinds of women from him. He sticks with his views and decides to go home to a TV dinner and his dog, Rusty.",The party is over.,Get out and dance with someone like that at a party.,"#Person2# tells Rocky that #Person2# wants a woman who's affectionate and fulfills #Person2#'s every need. Rocky wants a woman who'll stay home, cook, clean, and watch TV. #Person1# thinks Rocky is the perfect woman. Rocky thinks #Person1#'s idea of the perfect woman is outgoing, caring, and non-judgmental about people's differences.","Rocky wants a woman who's affectionate and fulfills his every need. He wants a woman who'll stay home, cook, clean, and watch the kids, and he wants a woman who's outgoing, caring, and non-judgmental about people's differences. #Person1# thinks he's not going to get married."
399,#Person1# and #Person2# is talking about the heavy storm last night. #Person2# thinks the weather is terrible. #Person1# is positive towards that.,The weather was terrible last night.,The weather is terrible.,#Person1# and #Person2# are talking about the weather last night. #Person1# thinks the weather is terrible and #Person2# thinks the weather is terrible.,#Person1# and #Person2# are talking about the heavy storm last night. #Person2# hates storms and thinks it's time for spring weather.
400,"#Person1# and #Person2# are talking about the heavy storm last night, and #Person1#'s positive. #Person2# thinks the weather is terrible. #Person1# thinks they should not complain.",The weather was terrible last night.,The weather is terrible.,#Person1# and #Person2# are talking about the weather last night. #Person1# thinks the weather is terrible and #Person2# thinks the weather is terrible.,#Person1# and #Person2# are talking about the heavy storm last night. #Person2# hates storms and thinks it's time for spring weather.
401,#Person2# complains the terrible storm last night and wishes for nice weather. #Person1# thinks they should not complain.,"Storms are bad, but the weather is terrible.",The weather is terrible.,#Person1# and #Person2# are talking about the weather last night. #Person1# thinks the weather is terrible and #Person2# thinks the weather is terrible.,#Person1# and #Person2# are talking about the heavy storm last night. #Person2# hates storms and thinks it's time for spring weather.
402,"#Person1# wants to watch TV together with #Person2#, but #Person2# finds it boring. #Person2# suggests doing music together.",The person is a good listener.,Watching TV is not something you want to do.,#Person1# doesn't want to watch TV with #Person2# because #Person2# doesn't like watching TV. #Person2# thinks watching TV is boring and #Person1# thinks watching TV is good for #Person2#. #Person2# thinks it's better to go out and share things.,#Person2# doesn't want to watch TV because #Person2# finds it boring. #Person1# suggests going out to enjoy themselves. #Person2# thinks there are lots of things to do that #Person2# can learn from.
403,"#Person1# asks #Person2# to watch TV with #Person1# at home. However, #Person2# finds it boring and suggests doing music together.",Watching TV isn't something I want to do.,Watching TV is not something you want to do.,#Person1# doesn't want to watch TV with #Person2# because #Person2# doesn't like watching TV. #Person2# thinks watching TV is boring and #Person1# thinks watching TV is good for #Person2#. #Person2# thinks it's better to go out and share things.,#Person2# doesn't want to watch TV because #Person2# finds it boring. #Person1# suggests going out to enjoy themselves. #Person2# thinks there are lots of things to do that #Person2# can learn from.
404,#Person1# wants #Person2# to watch TV with #Person1#. #Person2# thinks it is boring and suggests doing their music together.,- Ask yourself if you have a good time at home. - Ask yourself if you can watch TV with me. - Ask yourself if you can share your music.,Watching TV is not something you want to do.,#Person1# doesn't want to watch TV with #Person2# because #Person2# doesn't like watching TV. #Person2# thinks watching TV is boring and #Person1# thinks watching TV is good for #Person2#. #Person2# thinks it's better to go out and share things.,#Person2# doesn't want to watch TV because #Person2# finds it boring. #Person1# suggests going out to enjoy themselves. #Person2# thinks there are lots of things to do that #Person2# can learn from.
405,Ben feels a bit nervous about his new school life. #Person1# cheers him up and tells him about the schedule of the new school.,Ben is preparing for tomorrow's first class.,Ben and his classmates are going to have a good time at school tomorrow.,Ben is nervous about his preparation for tomorrow's lessons. #Person1# tells Ben that the first class starts at 8 o'clock and the class lasts 45 minutes. Ben will get to school before 7:30 and will be starving by then.,Ben is nervous about tomorrow's lessons. #Person1# tells him the time and the length of the first class. Ben will buy something to eat during the break after the second class.
406,Ben is nervous about his new school life. #Person1# is giving him some brief information about the school.,The first class begins at 8 o'clock and the second class begins at 8:30.,Ben and his classmates are going to have a good time at school tomorrow.,Ben is nervous about his preparation for tomorrow's lessons. #Person1# tells Ben that the first class starts at 8 o'clock and the class lasts 45 minutes. Ben will get to school before 7:30 and will be starving by then.,Ben is nervous about tomorrow's lessons. #Person1# tells him the time and the length of the first class. Ben will buy something to eat during the break after the second class.
407,Ben is nervous about the upcoming new school life. #Person1# comforts him and tells him the school daily routine.,The first class begins at 8 o'clock and ends at 7:30.,Ben and his classmates are going to have a good time at school tomorrow.,Ben is nervous about his preparation for tomorrow's lessons. #Person1# tells Ben that the first class starts at 8 o'clock and the class lasts 45 minutes. Ben will get to school before 7:30 and will be starving by then.,Ben is nervous about tomorrow's lessons. #Person1# tells him the time and the length of the first class. Ben will buy something to eat during the break after the second class.
408,Adam's knee is getting better but #Person1# still suggests that he should not do any running today. Adam decides to watch the films of Michigan after practice and will be back tomorrow for full practice.,The following is a list of the movies that Adam has seen on ESPN.,The doctor told Adam that he should be fine for Saturday's game.,Adam's knee is still giving him trouble. Adam tells #Person1# he should be fine for Saturday. He will be back tomorrow for full practice.,Adam's knee is fine today. #Person1# suggests practicing throwing and watching Michigan's games. Adam wants to see what they are up against and asks him to rest his knee.
409,Adam's knee is getting better but #Person1# suggests that he should not do any running today. Adam decides to see films of Michigan after practice and says he'll be back tomorrow for full practice.,The following is a list of recent football games Michigan will play in the next week.,The doctor told Adam that he should be fine for Saturday's game.,Adam's knee is still giving him trouble. Adam tells #Person1# he should be fine for Saturday. He will be back tomorrow for full practice.,Adam's knee is fine today. #Person1# suggests practicing throwing and watching Michigan's games. Adam wants to see what they are up against and asks him to rest his knee.
410,Adam's knee is getting better but #Person1# suggests that he should not do any running today. #Person1# says he can watch some films of Michigan after practice. Adam decides to go back tomorrow for full practice.,The Michigan team will play a game against Iowa on Saturday.,The doctor told Adam that he should be fine for Saturday's game.,Adam's knee is still giving him trouble. Adam tells #Person1# he should be fine for Saturday. He will be back tomorrow for full practice.,Adam's knee is fine today. #Person1# suggests practicing throwing and watching Michigan's games. Adam wants to see what they are up against and asks him to rest his knee.
411,#Person1# wants #Person2# to help to print up a copy. #Person2# accepts and edits it for #Person1#.,I'd be happy to help you.,#Person1#: I need to edit my paper.,#Person1# wants to print up a copy of #Person1#'s printer but #Person2#'s printer is broken. #Person1# asks #Person2# to edit it for #Person2#.,#Person1# asks #Person2# to help #Person1# with the printer problem. #Person2# agrees.
412,#Person1# asks for #Person2#'s help to print up a copy. #Person2# accepts and edits it for #Person1#.,"#Person2#: I'm sorry, but I can't do anything right now.",#Person1#: I need to edit my paper.,#Person1# wants to print up a copy of #Person1#'s printer but #Person2#'s printer is broken. #Person1# asks #Person2# to edit it for #Person2#.,#Person1# asks #Person2# to help #Person1# with the printer problem. #Person2# agrees.
413,#Person1# asks for #Person2#'s help to print up a copy. #Person2# accepts and edits it for #Person1#.,"#Person1#: I wonder if you can help me. #Person1#: Sure, I'd be happy to help you. #Person2#: Sure, I'd be happy to help you. #Person1#: Okay, thanks.",#Person1#: I need to edit my paper.,#Person1# wants to print up a copy of #Person1#'s printer but #Person2#'s printer is broken. #Person1# asks #Person2# to edit it for #Person2#.,#Person1# asks #Person2# to help #Person1# with the printer problem. #Person2# agrees.
414,#Person2# lets #Person1# hold the ladder and #Person2# will put the curtain up.,#Person2#: I'm doing a job.,"Honey, hold the ladder, and put the curtain up.",#Person1# wants to put the curtain up. #Person2# asks #Person1# to hold the ladder and put it up.,#Person2# helps #Person1# to put the curtain up.
415,#Person2# suggests that #Person1# hold the ladder and #Person2# will put the curtain up.,"Then, #Person1# will put the curtain up.","Honey, hold the ladder, and put the curtain up.",#Person1# wants to put the curtain up. #Person2# asks #Person1# to hold the ladder and put it up.,#Person2# helps #Person1# to put the curtain up.
416,#Person2# lets #Person1# hold the ladder and #Person2# will put the curtain up.,"Honey, can you hold the ladder?","Honey, hold the ladder, and put the curtain up.",#Person1# wants to put the curtain up. #Person2# asks #Person1# to hold the ladder and put it up.,#Person2# helps #Person1# to put the curtain up.
417,Jack is available for a camping trip the weekend after next.,"#Person1#: Jack, we're planning a weekend camping trip, and we want to know which weekend is best for everyone.",#Person1#: I'm planning a camping trip this weekend.,Jack asks Jack to check his calendar and decides which weekend is best for everyone. Jack tells Jack the weekend after next looks good.,Jack checks his calendar to find the best weekend for everyone.
418,Jack will be available for a weekend camping trip the weekend after next.,The camping trip is booked up.,#Person1#: I'm planning a camping trip this weekend.,Jack asks Jack to check his calendar and decides which weekend is best for everyone. Jack tells Jack the weekend after next looks good.,Jack checks his calendar to find the best weekend for everyone.
419,The weekend after next is suitable for Jack to have a camping trip.,#Person1#: We're planning a camping trip. #Person2#: No problem.,#Person1#: I'm planning a camping trip this weekend.,Jack asks Jack to check his calendar and decides which weekend is best for everyone. Jack tells Jack the weekend after next looks good.,Jack checks his calendar to find the best weekend for everyone.
420,#Person1# calls #Person2# to tell him that she was wrong to get upset over nothing and tells #Person2# she is pregnant. #Person2# feels happy. They go to the doctor. #Person2# finds out the baby isn't his because he was away the first week of February at a training seminar.,The baby is a new one.,The baby is a boy.,#Person1# tells #Person2# that #Person2# is pregnant and #Person2# is excited about the baby. #Person2# tells #Person1# that #Person2#'s due date is October twenty-seventh two thousand and nine.,#Person1# and #Person2# are talking about the pregnancy of #Person2#. #Person2# tells #Person1# that #Person2# is pregnant and #Person2# is pregnant. #Person1# is surprised.
421,"#Person1# calls #Person2# to tell him that she was wrong to get upset over nothing and tells him that she's pregnant. They go to see the doctor. However, #Person2# finds out the baby isn't his because he was away the first week of February at a training seminar.",The person who called you to leave said he was a firefighter.,The baby is a boy.,#Person1# tells #Person2# that #Person2# is pregnant and #Person2# is excited about the baby. #Person2# tells #Person1# that #Person2#'s due date is October twenty-seventh two thousand and nine.,#Person1# and #Person2# are talking about the pregnancy of #Person2#. #Person2# tells #Person1# that #Person2# is pregnant and #Person2# is pregnant. #Person1# is surprised.
422,"#Person1# apologises to #Person2# after the quarrel and tells #Person2# she's pregnant. #Person2# feels so happy and they decide to see the doctor. After the pregnancy test about the date, #Person2# finds that it is not his baby, because he was away the first week of February at a training seminar.",The baby is a boy.,The baby is a boy.,#Person1# tells #Person2# that #Person2# is pregnant and #Person2# is excited about the baby. #Person2# tells #Person1# that #Person2#'s due date is October twenty-seventh two thousand and nine.,#Person1# and #Person2# are talking about the pregnancy of #Person2#. #Person2# tells #Person1# that #Person2# is pregnant and #Person2# is pregnant. #Person1# is surprised.
423,#Person2# is worried about #Person2#'s daughter. #Person1# suggests #Person2# should encourage #Person2#'s daughter to make her own decision.,#Person1: I'm worried about my daughter. #Person2: Don't worry. #Person1#: I'm worried about my daughter. #Person1#: I'm worried about her. #Person2#: Don't worry. That's just a part of being a teenager. #Person1#: Don't worry.,Encourage her to make her own decisions.,#Person2#'s worried about #Person2#'s daughter's college decision. #Person2# encourages her to make up her mind by herself. #Person1# wants to give her some tips.,#Person2#'s worried about #Person2#'s daughter. #Person1# advises #Person2# to encourage her to make up her mind by herself.
424,#Person1# advises #Person2# to let #Person2#'s daughter make her own decisions instead of worrying about her.,Encourage her to make her own decision.,Encourage her to make her own decisions.,#Person2#'s worried about #Person2#'s daughter's college decision. #Person2# encourages her to make up her mind by herself. #Person1# wants to give her some tips.,#Person2#'s worried about #Person2#'s daughter. #Person1# advises #Person2# to encourage her to make up her mind by herself.
425,#Person1# suggests #Person2# letting the child make own decision instead of worrying about her.,I'm worried about my daughter.,Encourage her to make her own decisions.,#Person2#'s worried about #Person2#'s daughter's college decision. #Person2# encourages her to make up her mind by herself. #Person1# wants to give her some tips.,#Person2#'s worried about #Person2#'s daughter. #Person1# advises #Person2# to encourage her to make up her mind by herself.
426,#Person1# may lose #Person1#'s job because of a mistake that may cause a huge loss and a dishonest supervisor. #Person2# suggests #Person1# live with #Person2# and stop buying all the junk to save money if #Person1# loses the job. #Person1# agrees.,Talk to the person who lost his job.,Talk to the person who lost their job.,#Person1# thinks #Person1#'s job is impossible if #Person1# loses his job. #Person1# thinks #Person1#'s supervisor is dishonest and doesn't believe #Person1#'s boss. #Person2# suggests #Person1# move out of the apartment and move in with #Person1# until #Person1# finds another job. #Person1# thinks it's a good thing to lose #Person1#'s job.,#Person1# tells #Person2# that #Person1#'s supervisor is dishonest and will tell the boss the truth if #Person1# loses the job. #Person2# suggests #Person1# move in with #Person2# until #Person1# finds another job.
427,"#Person1# makes a big mistake which may cause a huge loss and #Person1# may lose this job because of the loss and #Person1#'s dishonest supervisor. #Person2# suggests that #Person1# move in with #Person2# until #Person1# find another job and stop buying all the junk, if #Person1# loses the job.",The conversation is about the following:,Talk to the person who lost their job.,#Person1# thinks #Person1#'s job is impossible if #Person1# loses his job. #Person1# thinks #Person1#'s supervisor is dishonest and doesn't believe #Person1#'s boss. #Person2# suggests #Person1# move out of the apartment and move in with #Person1# until #Person1# finds another job. #Person1# thinks it's a good thing to lose #Person1#'s job.,#Person1# tells #Person2# that #Person1#'s supervisor is dishonest and will tell the boss the truth if #Person1# loses the job. #Person2# suggests #Person1# move in with #Person2# until #Person1# finds another job.
428,"#Person1# might lose the job because of a working mistake and is worried about financial problems after losing a job. #Person2# suggests #Person1# save money until #Person1# find another job, if #Person1# loses the job.",The bosses will be very dishonest if they lose their job.,Talk to the person who lost their job.,#Person1# thinks #Person1#'s job is impossible if #Person1# loses his job. #Person1# thinks #Person1#'s supervisor is dishonest and doesn't believe #Person1#'s boss. #Person2# suggests #Person1# move out of the apartment and move in with #Person1# until #Person1# finds another job. #Person1# thinks it's a good thing to lose #Person1#'s job.,#Person1# tells #Person2# that #Person1#'s supervisor is dishonest and will tell the boss the truth if #Person1# loses the job. #Person2# suggests #Person1# move in with #Person2# until #Person1# finds another job.
429,#Person2#'s friend is visiting #Person2#. #Person2# invites him to give a speech about multimodal text generation. #Person1# will attend it.,I'm inviting a professor from the United Kingdom to give a speech at my lab.,I'm inviting my friend to give a speech at my lab.,#Person2# invites #Person1# to give a speech at #Person2#'s lab. #Person2# tells #Person1# the topic of the speech and #Person1#'s friend's Ph.D. student. #Person2# thinks #Person1#'s friend is very excellent and #Person1# wants to go too.,#Person2#'s friend dropped in from the United Kingdom and #Person2# invites #Person2#'s friend to give a speech at #Person2#'s lab. #Person2# thinks it sounds sophisticated.
430,#Person2#'s friend is a Ph.D. student at the University of Edinburgh. He is visiting #Person2# and will give a speech about multimodal text generation. #Person1# will attend it.,The person who is going to give a speech at the University of Edinburgh is a Ph.D. student at the University of Edinburgh.,I'm inviting my friend to give a speech at my lab.,#Person2# invites #Person1# to give a speech at #Person2#'s lab. #Person2# tells #Person1# the topic of the speech and #Person1#'s friend's Ph.D. student. #Person2# thinks #Person1#'s friend is very excellent and #Person1# wants to go too.,#Person2#'s friend dropped in from the United Kingdom and #Person2# invites #Person2#'s friend to give a speech at #Person2#'s lab. #Person2# thinks it sounds sophisticated.
431,#Person2#'s friend is visiting #Person2# and will give a speech about multimodal text generation. #Person1# thinks it interesting and will attend it.,I'm going to give a speech at the University of Edinburgh.,I'm inviting my friend to give a speech at my lab.,#Person2# invites #Person1# to give a speech at #Person2#'s lab. #Person2# tells #Person1# the topic of the speech and #Person1#'s friend's Ph.D. student. #Person2# thinks #Person1#'s friend is very excellent and #Person1# wants to go too.,#Person2#'s friend dropped in from the United Kingdom and #Person2# invites #Person2#'s friend to give a speech at #Person2#'s lab. #Person2# thinks it sounds sophisticated.
432,"#Person1# suggests going to John's house, but #Person2# feels sick and decides to go to sleep.",                                                                                                   ,Stay at home and rest.,#Person2# is getting sick and wants to stay at home and rest. #Person2# suggests #Person1# stay at home and rest. #Person2# agrees. #Person2# will make some soup and make some soup.,#Person2# is getting sick and wants to stay at home and rest. #Person1# suggests #Person2# stay at home and stay warm.
433,#Person2# prefers to stay at home and rest rather than go over to John's house tonight because #Person2# gets sick.,John's house is at John's.,Stay at home and rest.,#Person2# is getting sick and wants to stay at home and rest. #Person2# suggests #Person1# stay at home and rest. #Person2# agrees. #Person2# will make some soup and make some soup.,#Person2# is getting sick and wants to stay at home and rest. #Person1# suggests #Person2# stay at home and stay warm.
434,#Person2# doesn't want to go to John's house tonight because of getting sick. #Person2# decides to go to sleep.,#Person1: I'm getting sick.,Stay at home and rest.,#Person2# is getting sick and wants to stay at home and rest. #Person2# suggests #Person1# stay at home and rest. #Person2# agrees. #Person2# will make some soup and make some soup.,#Person2# is getting sick and wants to stay at home and rest. #Person1# suggests #Person2# stay at home and stay warm.
435,Mr. Faber calls #Person1# to book a double room for 3 nights at York Hotel.,You're ready to go.,Book a room at York Hotel for July 3rd.,#Person1# wants to book a double room for 3 nights. Mr. Faber calls #Person1# to book a double room until the twenty-third.,Mr. Faber wants to book a double room for three nights at York Hotel. #Person1# helps him book one double room for three nights.
436,Mr. Faber books a double room for 3 nights from July 20th at York Hotel.,Booking a room at York Hotel for 3 nights is a good idea.,Book a room at York Hotel for July 3rd.,#Person1# wants to book a double room for 3 nights. Mr. Faber calls #Person1# to book a double room until the twenty-third.,Mr. Faber wants to book a double room for three nights at York Hotel. #Person1# helps him book one double room for three nights.
