,human_baseline_summaries,original_model_summaries,instruct_model_summaries,peft_ia3_model_summaries,peft_lora_model_summaries
1134,#Person1# asks Mr. Smith for arrangements of tomorrow. Mr. Smith decides to visit a village in the mountains.,Then we'll have a visit to a village in the mountains tomorrow morning.,The visit to the village in the mountains is scheduled for tomorrow.,Mr. Smith tells Mr. Smith about the visit to a village planned for tomorrow. Mr. Smith suggests that they visit the village in the mountains. Mr. Smith suggests that they get up early tomorrow.,Mr. Smith tells #Person1# about the visit to a village in the mountains tomorrow. #Person1# will have lunch at the village and get back before supper.
1135,#Person1# introduces two different villages to visit and Mr. Smith decides to visit the village in the mountains.,"Mr. Smith, I'm going to the mountain village tomorrow.",The visit to the village in the mountains is scheduled for tomorrow.,Mr. Smith tells Mr. Smith about the visit to a village planned for tomorrow. Mr. Smith suggests that they visit the village in the mountains. Mr. Smith suggests that they get up early tomorrow.,Mr. Smith tells #Person1# about the visit to a village in the mountains tomorrow. #Person1# will have lunch at the village and get back before supper.
1136,#Person1# is asking which village Mr. Smith wants to visit so they can make arrangements. Mr. Smith chooses the village in the mountains.,The meeting is in the auditorium of the New York University.,The visit to the village in the mountains is scheduled for tomorrow.,Mr. Smith tells Mr. Smith about the visit to a village planned for tomorrow. Mr. Smith suggests that they visit the village in the mountains. Mr. Smith suggests that they get up early tomorrow.,Mr. Smith tells #Person1# about the visit to a village in the mountains tomorrow. #Person1# will have lunch at the village and get back before supper.
1137,"#Person1# interviews Vet, a high school girl who has become a mother. She shows her love to her daughter and talks about her future plans and gives advice to teens.",Talk to a counselor about your stress and depression.,Talk to Vet about your goals and dreams.,Vet tells #Person2# that having a baby has stopped him from his goals or dreams. Vet wants to be a cheerleader and wants to move out of Utah. Vet also tells #Person1# what his future goals and dreams are. Vet also tells #Person2# what's his favorite quote and advice for teens.,Vet tells #Person1# he eats cucumber and go to bed to deal with stress and depression. Vet tells #Person1# his favorite part of having a daughter is watching her go through every stage knowing there is somebody who loves her. Vet also tells #Person1# his future goals and dreams. Vet also tells #Person1# his favorite quote and advice for teens.
1138,Vet tells her own experience as a young mother and how her daughter changes her. Then she tells #Person1# her future goals and dreams. And she also gives teens advice.,": Vet, can you tell us what you do to deal with stress and depression?",Talk to Vet about your goals and dreams.,Vet tells #Person2# that having a baby has stopped him from his goals or dreams. Vet wants to be a cheerleader and wants to move out of Utah. Vet also tells #Person1# what his future goals and dreams are. Vet also tells #Person2# what's his favorite quote and advice for teens.,Vet tells #Person1# he eats cucumber and go to bed to deal with stress and depression. Vet tells #Person1# his favorite part of having a daughter is watching her go through every stage knowing there is somebody who loves her. Vet also tells #Person1# his future goals and dreams. Vet also tells #Person1# his favorite quote and advice for teens.
1139,"#Person1# is interviewing Vet and asking her about the ways she deals with stress as a young mother, feelings of having a baby, plans for the future, her favorite quote, and advice for teens.",#Person1: I am a cheerleader. #Person2: I want to be a lawyer. #Person3: I miss my freedom. #Person1: I miss my daughter. #Person2: I miss my future. #Person3: I am going to be a lawyer. #Person4: I want to start small. #Person1: I am going to be a cheerleader. #Person2: I hope to be a lawyer. #Person2: I hope to be a lawyer. #Person3: I hope to be a lawyer. #Person3: I hope to start small.,Talk to Vet about your goals and dreams.,Vet tells #Person2# that having a baby has stopped him from his goals or dreams. Vet wants to be a cheerleader and wants to move out of Utah. Vet also tells #Person1# what his future goals and dreams are. Vet also tells #Person2# what's his favorite quote and advice for teens.,Vet tells #Person1# he eats cucumber and go to bed to deal with stress and depression. Vet tells #Person1# his favorite part of having a daughter is watching her go through every stage knowing there is somebody who loves her. Vet also tells #Person1# his future goals and dreams. Vet also tells #Person1# his favorite quote and advice for teens.
1140,#Person2# talks about #Person2#'s hobby of collecting stamps. And they all agree that stamps collecting gives more pleasure than becoming wealthy.,The first postage stamps were issued in 1840.,I'm a stamp collector.,#Person2# tells #Person1# that #Person2# has loved collecting stamps for 9 years. #Person2# thinks collecting stamps gives #Person1# much pleasure.,#Person2# tells #Person1# that #Person2# became interested in collecting stamps when #Person2# was about ten years old. #Person2# thinks collecting stamps gives #Person2# pleasure.
1141,#Person2# describes #Person2#'s own stamp collecting hobby and the first postage stamps to #Person1#. They all agree that stamps collecting gives much pleasure than becoming wealthy.,The first postage stamps were issued in Britain in 1840.,I'm a stamp collector.,#Person2# tells #Person1# that #Person2# has loved collecting stamps for 9 years. #Person2# thinks collecting stamps gives #Person1# much pleasure.,#Person2# tells #Person1# that #Person2# became interested in collecting stamps when #Person2# was about ten years old. #Person2# thinks collecting stamps gives #Person2# pleasure.
1142,#Person2# talks about #Person2#'s interest in collecting stamps and the first postage stamps with #Person1#. It gives #Person2# much pleasure. They all agree that stamps collecting gives much pleasure than becoming wealthy.,#Person2#: You are a very good collector.,I'm a stamp collector.,#Person2# tells #Person1# that #Person2# has loved collecting stamps for 9 years. #Person2# thinks collecting stamps gives #Person1# much pleasure.,#Person2# tells #Person1# that #Person2# became interested in collecting stamps when #Person2# was about ten years old. #Person2# thinks collecting stamps gives #Person2# pleasure.
1143,"#Person1# interviews Tom about his experience to start a company selling green products, how to live a mildly green life and to learn from mistakes.",Is it true that you are a green businessman?,"In high school, Tom started a web-designed company.",Tom is a successful businessman. He started a web-designed company and learned a lot from his experience. He has raised 18 million dollars from about 50 people and has raised 18 million dollars from about 50 people. He owns 6% of the company and all employees get their shares. Tom thinks he has ever done anything wrong.,Tom tells #Person1# he started a web-designed company in high school and learned a lot from that experience. He now owns 6% of the company and all employees get their shares. He is mildly green and does simple things and a biker.
1144,#Person1# inquires Tom about his successful business experience and his own green life and how to learn from mistakes.,I'm a very green person. I bike cross-Canada. I'm a huge biker. I'm a designer.,"In high school, Tom started a web-designed company.",Tom is a successful businessman. He started a web-designed company and learned a lot from his experience. He has raised 18 million dollars from about 50 people and has raised 18 million dollars from about 50 people. He owns 6% of the company and all employees get their shares. Tom thinks he has ever done anything wrong.,Tom tells #Person1# he started a web-designed company in high school and learned a lot from that experience. He now owns 6% of the company and all employees get their shares. He is mildly green and does simple things and a biker.
1145,"#Person1# is interviewing Tom about how he had his own company, how he found the money, what aspects of his life are green, and if he has done something wasteful.",A company manager has started a new company.,"In high school, Tom started a web-designed company.",Tom is a successful businessman. He started a web-designed company and learned a lot from his experience. He has raised 18 million dollars from about 50 people and has raised 18 million dollars from about 50 people. He owns 6% of the company and all employees get their shares. Tom thinks he has ever done anything wrong.,Tom tells #Person1# he started a web-designed company in high school and learned a lot from that experience. He now owns 6% of the company and all employees get their shares. He is mildly green and does simple things and a biker.
1146,"Detective Chief Superintendent John Day is trying to figure out the murdered man's movements in the short gap between he left the club and got murdered, but he only has three witnesses and hasn't been able to identify more.",Police are investigating the death of a man believed to be in his forties whose body was found in a pedestrian subway in North London.,Police are treating the death of a man believed to be in his forties as murder.,"#Person1# and Detective Chief Superintendent John Day are investigating the murder of a man who was found in a pedestrian subway in Neasden. They find out that the man left the Level One Club, which is a drinking club in Neasden Lane, was found in the underpass, and the area was a pedestrian way. They also find out that there were other people who left the club.",#Person1# and #Person2# are talking about the murder of a man thought to be in his forties whose body was found in a pedestrian subway in Neasden. #Person2# tells #Person1# the time of the death and the location of the drinking club. #Person1# thinks #Person2# hasn't been able to identify the people.
1147,"John Day describes known details of a murder case which happened in a pedestrian subway at midnight and answers #Person1#'s questions to tell what he know about the case. But he hasn't be able to identify more, even he knows three witnesses.",A man has been found dead in a subway subway subway in Neasden.,Police are treating the death of a man believed to be in his forties as murder.,"#Person1# and Detective Chief Superintendent John Day are investigating the murder of a man who was found in a pedestrian subway in Neasden. They find out that the man left the Level One Club, which is a drinking club in Neasden Lane, was found in the underpass, and the area was a pedestrian way. They also find out that there were other people who left the club.",#Person1# and #Person2# are talking about the murder of a man thought to be in his forties whose body was found in a pedestrian subway in Neasden. #Person2# tells #Person1# the time of the death and the location of the drinking club. #Person1# thinks #Person2# hasn't been able to identify the people.
1148,"John Day is telling #Person1# what they've known of the dead man's movements in the early hours of the morning, and there may be three witnesses, two girls and a man, but he hasn't been able to identify more.","A man found dead in a pedestrian subway in Neasden, England, was found by a member of the Level One Club at 1:30 a.m., and was found by a member of the club, an employee.",Police are treating the death of a man believed to be in his forties as murder.,"#Person1# and Detective Chief Superintendent John Day are investigating the murder of a man who was found in a pedestrian subway in Neasden. They find out that the man left the Level One Club, which is a drinking club in Neasden Lane, was found in the underpass, and the area was a pedestrian way. They also find out that there were other people who left the club.",#Person1# and #Person2# are talking about the murder of a man thought to be in his forties whose body was found in a pedestrian subway in Neasden. #Person2# tells #Person1# the time of the death and the location of the drinking club. #Person1# thinks #Person2# hasn't been able to identify the people.
1149,"Sherry is going to Quebec for a friend's wedding and sightseeing. Bob tells her some basic knowledge of Quebec, describes the beautiful scenery, and suggests practicing French.",You'll need to be a native speaker of French to visit Quebec.,You're going to Montreal.,Bob is going to visit Quebec next summer. Sherry tells Bob that he's going to visit Quebec next summer and wants to do some sightseeing. Sherry tells Bob that he's going to visit Quebec next summer. Sherry will visit a friend's wedding in Montreal and will visit a friend from college.,Sherry is going to visit Quebec next summer to go to a friend's wedding. Bob tells Sherry the province is the capital city of the province and she will visit Quebec City.
1150,Sherry will attend a wedding in Montreal and wants to go sightseeing in nearby cities. Bob gives her some basic knowledge about the cities and Sherry cannot wait to go.,I'm going to visit Quebec next summer. I'm going to visit a friend's wedding.,You're going to Montreal.,Bob is going to visit Quebec next summer. Sherry tells Bob that he's going to visit Quebec next summer and wants to do some sightseeing. Sherry tells Bob that he's going to visit Quebec next summer. Sherry will visit a friend's wedding in Montreal and will visit a friend from college.,Sherry is going to visit Quebec next summer to go to a friend's wedding. Bob tells Sherry the province is the capital city of the province and she will visit Quebec City.
1151,"Sherry will go to Montreal, Quebec next summer. Bob suggests she practice French since Montreal is the third largest French-speaking city. Sherry will also visit a friend in Quebec City.",The Santa Lawrence River runs through the heart of Montreal.,You're going to Montreal.,Bob is going to visit Quebec next summer. Sherry tells Bob that he's going to visit Quebec next summer and wants to do some sightseeing. Sherry tells Bob that he's going to visit Quebec next summer. Sherry will visit a friend's wedding in Montreal and will visit a friend from college.,Sherry is going to visit Quebec next summer to go to a friend's wedding. Bob tells Sherry the province is the capital city of the province and she will visit Quebec City.
1152,"Tom suggests going swimming, but Jane refuses. They decide to meet at the Grill to eat and then go to study together in the library.",Jane and Tom are going to go to the Grill.,Jane and Tom are going to go swimming tomorrow.,Jane wants to go swimming at the Student Center but Tom has a test tomorrow and she has a paper due. Tom will go over to the Grill and eat something and go home. Jane will go home first.,Tom invites Jane to go swimming at the Student Center but Jane has a paper due on Friday. Jane agrees to go over there with Tom after dinner. Tom will meet Jane at the Grill about six.
1153,"Tom suggests going swimming but Jane refuses beacuse of her paper due. After discussion, Jane finnally agrees to have dinner with him and then go to study together in the library.",The students are going to a swimming tournament.,Jane and Tom are going to go swimming tomorrow.,Jane wants to go swimming at the Student Center but Tom has a test tomorrow and she has a paper due. Tom will go over to the Grill and eat something and go home. Jane will go home first.,Tom invites Jane to go swimming at the Student Center but Jane has a paper due on Friday. Jane agrees to go over there with Tom after dinner. Tom will meet Jane at the Grill about six.
1154,"Toms invites Jane to go swimming but Jane refuses because of a paper due. At last, Jane accepts his suggestion to have dinner and then study together in the library.",Jane and Tom will go swimming at the Student Center on Friday.,Jane and Tom are going to go swimming tomorrow.,Jane wants to go swimming at the Student Center but Tom has a test tomorrow and she has a paper due. Tom will go over to the Grill and eat something and go home. Jane will go home first.,Tom invites Jane to go swimming at the Student Center but Jane has a paper due on Friday. Jane agrees to go over there with Tom after dinner. Tom will meet Jane at the Grill about six.
1155,#Person2# suggests that #Person1# should listen to the doctor.,I can't believe I still have this pain in my back. This medicine the doctor gave me was supposed to make me feel better by now.,Take the medicine.,#Person1# feels pain in #Person2#'s back and suggests taking medicine three times a day.,#Person1# still has pain in #Person1#'s back. #Person2# suggests #Person1# take the medicine three times a day.
1156,#Person2# suggests #Person1# follow the medical instruction.,The doctor told me that I still have pain in my back.,Take the medicine.,#Person1# feels pain in #Person2#'s back and suggests taking medicine three times a day.,#Person1# still has pain in #Person1#'s back. #Person2# suggests #Person1# take the medicine three times a day.
1157,#Person2# suggests that #Person1# should follow the doctor's instruction.,The person is a doctor who is trying to help her with a back pain.,Take the medicine.,#Person1# feels pain in #Person2#'s back and suggests taking medicine three times a day.,#Person1# still has pain in #Person1#'s back. #Person2# suggests #Person1# take the medicine three times a day.
1158,#Person1# borrows 200 yuan from Fred and will give it back when having money.,I'm in trouble.,The phone is out of service.,Fred wants 200 yuan to borrow some money from Fred. Fred will pay Fred back as soon as he gets back on his feet.,#Person1#'s cell phone is out of service again. Fred helps #Person1# to pay the mortgage. #Person1# will pay Fred back as soon as #Person1# gets back on #Person1#'s feet.
1159,#Person1# borrows 200 yuan from Fred to pay the mortgage of a computer and will pay back when having money.,The phone is out of service again.,The phone is out of service.,Fred wants 200 yuan to borrow some money from Fred. Fred will pay Fred back as soon as he gets back on his feet.,#Person1#'s cell phone is out of service again. Fred helps #Person1# to pay the mortgage. #Person1# will pay Fred back as soon as #Person1# gets back on #Person1#'s feet.
1160,Fred lends #Person1# 200 yuan to pay #Person1#'s mortgage. #Person1# will pay back when having money.,Someone1#: I'm so sorry to hear that.,The phone is out of service.,Fred wants 200 yuan to borrow some money from Fred. Fred will pay Fred back as soon as he gets back on his feet.,#Person1#'s cell phone is out of service again. Fred helps #Person1# to pay the mortgage. #Person1# will pay Fred back as soon as #Person1# gets back on #Person1#'s feet.
1161,#Person1# wants to improve handwriting but can't see the progress. #Person2# tells #Person1# the most important is perseverance.,"#Person1#: I want to improve my handwriting. #Person2#: I know it, but my handwriting is still bad. #Person1#: I know it, but I don't know when I can make it better. #Person2#: Aw, you know it, but my handwriting is still bad. #Person1#: I know it, but I don't know when I can make it better. #Person2#: Aw, you know it, but my handwriting is still bad. #Person1#: I know it, but I don't know when I can make it better. #Person2#: Aw, you know it, but my handwriting is still bad. #Person2#: Aw, you know it, but my handwriting is still bad. #Person1#: Aw, you know it, but I",Don't be afraid to be patient.,"#Person1# wants to improve his handwriting, but #Person2# doesn't know when #Person1# can make it better. #Person1# tells #Person2# perseverance is the most important thing. #Person1# must stop complaining and stick to it every day.",#Person1# wants to improve #Person1#'s handwriting. #Person2# tells #Person1# to be patient and stick to it every day.
1162,#Person2# encourages #Person1# to persevere with handwriting practice when #Person1# complains about little improvement in handwriting.,"I've practiced handwriting for weeks, but I'ven't made any progress.",Don't be afraid to be patient.,"#Person1# wants to improve his handwriting, but #Person2# doesn't know when #Person1# can make it better. #Person1# tells #Person2# perseverance is the most important thing. #Person1# must stop complaining and stick to it every day.",#Person1# wants to improve #Person1#'s handwriting. #Person2# tells #Person1# to be patient and stick to it every day.
1163,"#Person2# encourages #Person1# to keep practice handwriting, even though #Person1# hasn't got too much improvement now.",The person is trying to improve his handwriting.,Don't be afraid to be patient.,"#Person1# wants to improve his handwriting, but #Person2# doesn't know when #Person1# can make it better. #Person1# tells #Person2# perseverance is the most important thing. #Person1# must stop complaining and stick to it every day.",#Person1# wants to improve #Person1#'s handwriting. #Person2# tells #Person1# to be patient and stick to it every day.
1164,"#Person2# is curling eyelashes. #Person1# feels dangerous, but #Person2# doesn't think so.",You're a wimp.,- You're a wimp. - You're a wimp. - You're a wimp.,#Person2# is curling #Person2#'s eyelashes. #Person1# thinks #Person2# is afraid of an eyelash curler. #Person2# thinks #Person2#'s afraid of an eyelash curler.,#Person2# is curling #Person2#'s eyelashes. #Person1# thinks it's primitive form of torture.
1165,#Person1# is afraid that eyelash curler may hurt #Person2#'s eyes.,#Person1: #Person2: I'm doing some sneezing. #Person1: I'm not a wimp.,- You're a wimp. - You're a wimp. - You're a wimp.,#Person2# is curling #Person2#'s eyelashes. #Person1# thinks #Person2# is afraid of an eyelash curler. #Person2# thinks #Person2#'s afraid of an eyelash curler.,#Person2# is curling #Person2#'s eyelashes. #Person1# thinks it's primitive form of torture.
1166,"#Person1# thinks the eyelash curler is very dangerous, but #Person2# doesn't think so.",#Person1: You're a wimp!,- You're a wimp. - You're a wimp. - You're a wimp.,#Person2# is curling #Person2#'s eyelashes. #Person1# thinks #Person2# is afraid of an eyelash curler. #Person2# thinks #Person2#'s afraid of an eyelash curler.,#Person2# is curling #Person2#'s eyelashes. #Person1# thinks it's primitive form of torture.
1167,#Person1# introduces the weekend driving courses to #Person2#. #Person2# feels satisfied with its settings.,The driving courses are for the summer.,The driving courses are offered at the 8:00 AM and 6:00 AM.,#Person2# wants to know about driving courses and the coaches. #Person1# tells #Person2# about the driving courses and the coaches. #Person2# will have more chances to get trained.,"#Person2# wants to know about the driving courses. #Person1# tells #Person2# about the driving courses, the coaches, and the training schedule."
1168,"#Person2# consults #Person1# about the training time, training chances and coach's experience of the driving courses. #Person2# thinks weekend courses are good.",The course starts at 8:00 and the coaches at 6:00 PM.,The driving courses are offered at the 8:00 AM and 6:00 AM.,#Person2# wants to know about driving courses and the coaches. #Person1# tells #Person2# about the driving courses and the coaches. #Person2# will have more chances to get trained.,"#Person2# wants to know about the driving courses. #Person1# tells #Person2# about the driving courses, the coaches, and the training schedule."
1169,#Person2# is asking #Person1# some information about the driving courses. #Person2# thinks weekend courses are good.,"If you are interested in driving, you can go to the driving courses.",The driving courses are offered at the 8:00 AM and 6:00 AM.,#Person2# wants to know about driving courses and the coaches. #Person1# tells #Person2# about the driving courses and the coaches. #Person2# will have more chances to get trained.,"#Person2# wants to know about the driving courses. #Person1# tells #Person2# about the driving courses, the coaches, and the training schedule."
1170,Tina plays the piano well because she has an excellent teacher. She agrees to introduce #Person1# to her teacher.,I'm learning from my father's teacher.,Tina will learn the piano from her father.,Tina has been learning the piano for 8 years and she has been learning it from her father. Tina introduces her to her teacher and introduces her to her.,Tina tells #Person1# she has been learning the piano for 8 years and she is still learning it from her teacher. #Person1# invites her to learn from her.
1171,Tina plays the piano well because she has an excellent teacher. #Person1# wants to learn piano from that teacher and Tina will introduce her teacher.,The teacher at the piano class is from the UK.,Tina will learn the piano from her father.,Tina has been learning the piano for 8 years and she has been learning it from her father. Tina introduces her to her teacher and introduces her to her.,Tina tells #Person1# she has been learning the piano for 8 years and she is still learning it from her teacher. #Person1# invites her to learn from her.
1172,Tina plays the piano well because of her excellent teacher and she agrees to introduce #Person1# to her teacher .,Tina has been learning the piano for 8 years.,Tina will learn the piano from her father.,Tina has been learning the piano for 8 years and she has been learning it from her father. Tina introduces her to her teacher and introduces her to her.,Tina tells #Person1# she has been learning the piano for 8 years and she is still learning it from her teacher. #Person1# invites her to learn from her.
