,human_baseline_summaries,original_model_summaries,instruct_model_summaries,peft_ia3_model_summaries,peft_lora_model_summaries
778,#Person2#'s wallet was lost and has to borrow some money from #Person1#.,I'll wait for you.,I lost my wallet.,#Person2# lost #Person2#'s wallet and #Person2# borrows some money. #Person1# will pay #Person2# back on Friday. #Person2# will buy some books and go to the gas station.,#Person2# lost #Person2#'s wallet. #Person1# helps #Person2# borrow 50 dollars and will pay #Person2# back on Friday. #Person2# will buy some books and go to the gas station.
779,#Person1# lends money to #Person2# as #Person2# lost the wallet.,The person who lost his wallet is a taxi driver.,I lost my wallet.,#Person2# lost #Person2#'s wallet and #Person2# borrows some money. #Person1# will pay #Person2# back on Friday. #Person2# will buy some books and go to the gas station.,#Person2# lost #Person2#'s wallet. #Person1# helps #Person2# borrow 50 dollars and will pay #Person2# back on Friday. #Person2# will buy some books and go to the gas station.
780,#Person1# and #Person2# are talking about the news that two competing companies are going to merge into one.,I'm a big fan of Murphy Music and U-Tunes.,- I'm not sure if Murphy Music and U-Tunes are going to merge.,"#Person1# and #Person2# are discussing the merger of Murphy Music and U-Tunes. They are supposed to be bitter enemies, strictest of competitors, and they will join together. #Person1# thinks the competition must have been too stiff for U-Tunes.",#Person1# and #Person2# are discussing the merger of two major suppliers. #Person1# thinks the competition must have been too stiff for U-Tunes. #Person2# thinks it's a rumor.
781,#Person2# learns from #Person1# that two major suppliers of their company decided to end competition and merge into one.,"Two of our major suppliers, Murphy Music and U-Tunes, are merging. Murphy will take over the company as U-Tunes, U-Tunes will take over the company as U-Tunes. U-Tunes will take over the company as U-Tunes.",- I'm not sure if Murphy Music and U-Tunes are going to merge.,"#Person1# and #Person2# are discussing the merger of Murphy Music and U-Tunes. They are supposed to be bitter enemies, strictest of competitors, and they will join together. #Person1# thinks the competition must have been too stiff for U-Tunes.",#Person1# and #Person2# are discussing the merger of two major suppliers. #Person1# thinks the competition must have been too stiff for U-Tunes. #Person2# thinks it's a rumor.
782,"#Person1# and #Person2# have a discussion on the merging of their major suppliers, Murphy Music and U-Tunes and its effect.",Murphy Music and U-Tunes are merging.,- I'm not sure if Murphy Music and U-Tunes are going to merge.,"#Person1# and #Person2# are discussing the merger of Murphy Music and U-Tunes. They are supposed to be bitter enemies, strictest of competitors, and they will join together. #Person1# thinks the competition must have been too stiff for U-Tunes.",#Person1# and #Person2# are discussing the merger of two major suppliers. #Person1# thinks the competition must have been too stiff for U-Tunes. #Person2# thinks it's a rumor.
783,Joe and Tom hold different impressions on Tom's new assistant.,Joe met his new assistant Emm.,Joe met Emm.,Joe met Joe's new assistant Tom. Joe is surprised and he thinks Tom is helpful. Tom thinks Joe is his boss.,Joe met Emm's new assistant but Tom isn't impressed. Joe thinks Emm is helpful but Tom thinks she never greets him.
784,Joe doesn't think highly of Tom's new assistant while Tom does.,I met my new assistant.,Joe met Emm.,Joe met Joe's new assistant Tom. Joe is surprised and he thinks Tom is helpful. Tom thinks Joe is his boss.,Joe met Emm's new assistant but Tom isn't impressed. Joe thinks Emm is helpful but Tom thinks she never greets him.
785,Joe disagrees with Tom on Tom's new assistant and thinks her stuck up.,- a new assistant met the new one. - a new assistant met the new one.,Joe met Emm.,Joe met Joe's new assistant Tom. Joe is surprised and he thinks Tom is helpful. Tom thinks Joe is his boss.,Joe met Emm's new assistant but Tom isn't impressed. Joe thinks Emm is helpful but Tom thinks she never greets him.
786,Sarah is upset and complains to #Person1# about an inefficient meeting and Bob's interruption. #Person1# gives Sarah some suggestions on how to keep her speech short and sweet.,The meeting was not very efficient.,The meeting was not efficient.,Sarah is upset because she just came out of a meeting and she doesn't listen to any of her suggestions. Bob keeps interrupting everyone with his own suggestions and didn't want to hear what others had to say. Sarah wants to make the meeting more efficient. Sarah will try to explain something complicated.,Sarah tells #Person1# Bob kept interrupting everyone with his own suggestions and expected everyone to agree with him. Sarah thinks Bob should keep things short and sweet and bring up the main points during the meeting.
787,"Sarah is upset because Bob kept interrupting everyone else during a meeting, making it impossible to elaborate her ideas. #Person1# gives Sarah a useful tip to get her point across at the next meeting.",The meeting was a little boring.,The meeting was not efficient.,Sarah is upset because she just came out of a meeting and she doesn't listen to any of her suggestions. Bob keeps interrupting everyone with his own suggestions and didn't want to hear what others had to say. Sarah wants to make the meeting more efficient. Sarah will try to explain something complicated.,Sarah tells #Person1# Bob kept interrupting everyone with his own suggestions and expected everyone to agree with him. Sarah thinks Bob should keep things short and sweet and bring up the main points during the meeting.
788,"Sarah is upset for being interrupted by Bob in an meeting and is not able to put forward the points, to which #Person1# offers some useful tips.",Talk to the people who are not the ones who are the people who are the people who are the people who are the people who are the people who are the people who are the people who are the people.,The meeting was not efficient.,Sarah is upset because she just came out of a meeting and she doesn't listen to any of her suggestions. Bob keeps interrupting everyone with his own suggestions and didn't want to hear what others had to say. Sarah wants to make the meeting more efficient. Sarah will try to explain something complicated.,Sarah tells #Person1# Bob kept interrupting everyone with his own suggestions and expected everyone to agree with him. Sarah thinks Bob should keep things short and sweet and bring up the main points during the meeting.
789,#Person2# introduces one program about Islam to #Person1#. They are talking about the pilgrimages of Muslims and people in other faiths.,I'm a Muslim. I'm a muslim. I'm a pilgrim.,Watch a program about islam.,#Person2# tells #Person1# about the pilgrimage to mecca and the reasons why people go on a haj. #Person2# thinks there is something magical about Lourdes.,#Person2# tells #Person1# about a program about islam. #Person2# thinks pilgrimage to mecca is a pilgrimage. #Person1# thinks pilgrimage is common in many faiths and Lourdes is a place where people go to get healed.
790,"#Person1# and #Person2# talk about pilgrims around the world, including Muslims' pilgrimage to mecca and Christians' pilgrimage to Canterbury or Vatican. #Person2# thinks faith heals people instead of magical places.",The pilgrims are on a pilgrimage to Mecca.,Watch a program about islam.,#Person2# tells #Person1# about the pilgrimage to mecca and the reasons why people go on a haj. #Person2# thinks there is something magical about Lourdes.,#Person2# tells #Person1# about a program about islam. #Person2# thinks pilgrimage to mecca is a pilgrimage. #Person1# thinks pilgrimage is common in many faiths and Lourdes is a place where people go to get healed.
791,#Person2# watches a program about Muslim pilgrims and talks about how pilgrims are like in other religion with #Person1#,The program is about islam.,Watch a program about islam.,#Person2# tells #Person1# about the pilgrimage to mecca and the reasons why people go on a haj. #Person2# thinks there is something magical about Lourdes.,#Person2# tells #Person1# about a program about islam. #Person2# thinks pilgrimage to mecca is a pilgrimage. #Person1# thinks pilgrimage is common in many faiths and Lourdes is a place where people go to get healed.
792,Ted likes Jenny but is afraid to ask her out. Mike encourages Ted to tell Jenny his feelings.,The person with the most followers is Jenny.,"If you're rejected, you're not alone.",Mike asks Mike to tell Jenny he has a crush on Jenny. Mike tells Mike that he's afraid of telling her out. Mike thinks it's better to tell her out.,Ted asks Mike if Jenny has a crush on him. Mike tells Ted he has to tell Jenny what he's feeling about her. Ted thinks it's better to keep everything to himself.
793,Ted likesJenny but is too afraid to express his feeling. Mike encourages him and Ted will tell her.,You're a stranger to a girl like Jenny.,"If you're rejected, you're not alone.",Mike asks Mike to tell Jenny he has a crush on Jenny. Mike tells Mike that he's afraid of telling her out. Mike thinks it's better to tell her out.,Ted asks Mike if Jenny has a crush on him. Mike tells Ted he has to tell Jenny what he's feeling about her. Ted thinks it's better to keep everything to himself.
794,Ted likes Jenny but is afraid of telling her because he doesn't want to be turned down. Mike encourages Ted to tell Jenny.,Jenny has a crush on Ted.,"If you're rejected, you're not alone.",Mike asks Mike to tell Jenny he has a crush on Jenny. Mike tells Mike that he's afraid of telling her out. Mike thinks it's better to tell her out.,Ted asks Mike if Jenny has a crush on him. Mike tells Ted he has to tell Jenny what he's feeling about her. Ted thinks it's better to keep everything to himself.
795,#Person1# and #Person2# are talking about ways to relieve anger.,Listen to music. Work out.,Listen to music. Exercise.,"#Person2# tells #Person1# that #Person2# usually calm down first and think about the reason that caused #Person2#'s anger. #Person2# recommends listening to music, listening to music, working out, and working out.",#Person2# tells #Person1# #Person2# usually calm down and think about the reason that caused #Person2#'s anger. #Person2# also listens to classical music and work out.
796,"#Person2# introduces ways to relieve anger to #Person1#, including listening to music and working out.",Listen to music. Work out.,Listen to music. Exercise.,"#Person2# tells #Person1# that #Person2# usually calm down first and think about the reason that caused #Person2#'s anger. #Person2# recommends listening to music, listening to music, working out, and working out.",#Person2# tells #Person1# #Person2# usually calm down and think about the reason that caused #Person2#'s anger. #Person2# also listens to classical music and work out.
797,#Person1# and #Person2# have a discussion about what they usually do to relieve anger.,Listen to music. Listen to music. Listen to music. Listen to a good workout.,Listen to music. Exercise.,"#Person2# tells #Person1# that #Person2# usually calm down first and think about the reason that caused #Person2#'s anger. #Person2# recommends listening to music, listening to music, working out, and working out.",#Person2# tells #Person1# #Person2# usually calm down and think about the reason that caused #Person2#'s anger. #Person2# also listens to classical music and work out.
798,#Person2# is introducing to #Person1# their family members in New Zealand and their relationships.,The family in New Zealand are very nice.,You're talking about family in New Zealand.,#Person1# tells #Person2# that Bill is Bill's brother-in-law and his mother's brother. #Person2# tells #Person1# that Sarah and Jane are their cousins. They want to travel to Europe next year.,"#Person1# asks #Person2# about family in New Zealand. #Person2# tells #Person1# the family in New Zealand is Bill, Sarah, Jane, and Jane's step-mother."
799,#Person2# introduces to #Person1# their family members in New Zealand who would visit them next year.,"The family of Bill, his wife, and two of his daughters are in New Zealand.",You're talking about family in New Zealand.,#Person1# tells #Person2# that Bill is Bill's brother-in-law and his mother's brother. #Person2# tells #Person1# that Sarah and Jane are their cousins. They want to travel to Europe next year.,"#Person1# asks #Person2# about family in New Zealand. #Person2# tells #Person1# the family in New Zealand is Bill, Sarah, Jane, and Jane's step-mother."
800,"#Person2# tells #Person1# about the relationships between their family and the uncle Bill's, who will visit them next year.",You know the family in New Zealand?,You're talking about family in New Zealand.,#Person1# tells #Person2# that Bill is Bill's brother-in-law and his mother's brother. #Person2# tells #Person1# that Sarah and Jane are their cousins. They want to travel to Europe next year.,"#Person1# asks #Person2# about family in New Zealand. #Person2# tells #Person1# the family in New Zealand is Bill, Sarah, Jane, and Jane's step-mother."
801,#Person1# congratulates Mr. Stuart on winning a marathon.,You won the city marathon.,Congratulations!,Mr. Stuart wins the city marathon. Mr. Stuart is very excited and proud of Mr. Stuart. #Person1# and #Person2# are proud of Mr. Stuart's winning.,Mr. Stuart won the city marathon and #Person1# is proud of him.
802,#Person1# congratulates Mr. Stuart on winning the city marathon.,You won the city marathon.,Congratulations!,Mr. Stuart wins the city marathon. Mr. Stuart is very excited and proud of Mr. Stuart. #Person1# and #Person2# are proud of Mr. Stuart's winning.,Mr. Stuart won the city marathon and #Person1# is proud of him.
803,#Person1# congratulates Mr. Stuart on winning the city marathon.,Mr. Stuart won the city marathon.,Congratulations!,Mr. Stuart wins the city marathon. Mr. Stuart is very excited and proud of Mr. Stuart. #Person1# and #Person2# are proud of Mr. Stuart's winning.,Mr. Stuart won the city marathon and #Person1# is proud of him.
804,#Person2# is from America and is picking up presents for families in a duty-free shop. #Person1# recommends some for #Person2#.,I'm buying some shoes for my children and my wife.,I'm looking for some shoes for my children and wife.,#Person2# is picking out some presents for #Person1#'s children and wife. #Person1# recommends some very cool sneakers for #Person2# and #Person2# recommends a good one. #Person2# will take one.,#Person2# is picking out some presents for his children and wife. #Person1# recommends some cool sneakers for #Person2# and #Person2# takes 5 pairs. #Person2# thinks the perfume is expensive in America and #Person1# recommends a bottle of perfume.
805,#Person2# is surprised at a low price of products in the duty-free shop. #Person1# offers #Person2# suggestions on what gifts to bring home.,I'm going to buy some nice shoes for my children and wife.,I'm looking for some shoes for my children and wife.,#Person2# is picking out some presents for #Person1#'s children and wife. #Person1# recommends some very cool sneakers for #Person2# and #Person2# recommends a good one. #Person2# will take one.,#Person2# is picking out some presents for his children and wife. #Person1# recommends some cool sneakers for #Person2# and #Person2# takes 5 pairs. #Person2# thinks the perfume is expensive in America and #Person1# recommends a bottle of perfume.
806,#Person2# buys gifts for his children and wife in a duty-free shop where #Person1# is working at. #Person1# recommends presents for #Person2#.,I'm buying some shoes for my children and wife.,I'm looking for some shoes for my children and wife.,#Person2# is picking out some presents for #Person1#'s children and wife. #Person1# recommends some very cool sneakers for #Person2# and #Person2# recommends a good one. #Person2# will take one.,#Person2# is picking out some presents for his children and wife. #Person1# recommends some cool sneakers for #Person2# and #Person2# takes 5 pairs. #Person2# thinks the perfume is expensive in America and #Person1# recommends a bottle of perfume.
807,Hong suggests #Person1# use a local SIM card to save money to call.,You can use a SIM card to call the UK for 100 RMB.,You can use a local SIM card to call the UK.,Hong needs to call back to the UK but can't afford to pay for the roaming charges. #Person1# suggests using a local SIM card. Hong suggests using a local SIM card and it costs about 10 RMB per minute to call the UK.,#Person1# wants to call back to the UK but #Person1# can't afford to pay for the roaming charges. Hong recommends #Person1# to use a local SIM card.
808,Hong tells #Person1# to buy a local SIM card to make a cheap phone call to the UK.,"You can use a SIM card to call the UK, but you'll need to pay for the roaming charges.",You can use a local SIM card to call the UK.,Hong needs to call back to the UK but can't afford to pay for the roaming charges. #Person1# suggests using a local SIM card. Hong suggests using a local SIM card and it costs about 10 RMB per minute to call the UK.,#Person1# wants to call back to the UK but #Person1# can't afford to pay for the roaming charges. Hong recommends #Person1# to use a local SIM card.
809,#Person1# can't afford to call back to UK and Hong offers a cheap way to address the problem.,You can use a SIM card to call the UK.,You can use a local SIM card to call the UK.,Hong needs to call back to the UK but can't afford to pay for the roaming charges. #Person1# suggests using a local SIM card. Hong suggests using a local SIM card and it costs about 10 RMB per minute to call the UK.,#Person1# wants to call back to the UK but #Person1# can't afford to pay for the roaming charges. Hong recommends #Person1# to use a local SIM card.
810,Mr. Brown is interviewing #Person2# and they are talking over #Person2#'s salary.,Is it a job you're looking for?,You're a good candidate for the job.,"Mr. Brown tells #Person2# #Person2#'s monthly salary is 1,800 yuan per month. Mr. Brown tells #Person1# #Person2# can decide on his capacity and experience. Mr. Brown also offers a paid month holiday every year.","Mr. Brown tells #Person2# #Person2#'s monthly salary is 1,800 yuan per month and #Person2# hopes to get a month here. Mr. Brown suggests #Person2# pay two thousand and five hundred yuan a month at the start."
811,Mr. Brown gives #Person2# a well-paying job offer.,Mr. Brown is looking for a new job.,You're a good candidate for the job.,"Mr. Brown tells #Person2# #Person2#'s monthly salary is 1,800 yuan per month. Mr. Brown tells #Person1# #Person2# can decide on his capacity and experience. Mr. Brown also offers a paid month holiday every year.","Mr. Brown tells #Person2# #Person2#'s monthly salary is 1,800 yuan per month and #Person2# hopes to get a month here. Mr. Brown suggests #Person2# pay two thousand and five hundred yuan a month at the start."
812,Mr. Brown decides to hire #Person2# with a higher salary and other benefits.,You're paid on a salary basis.,You're a good candidate for the job.,"Mr. Brown tells #Person2# #Person2#'s monthly salary is 1,800 yuan per month. Mr. Brown tells #Person1# #Person2# can decide on his capacity and experience. Mr. Brown also offers a paid month holiday every year.","Mr. Brown tells #Person2# #Person2#'s monthly salary is 1,800 yuan per month and #Person2# hopes to get a month here. Mr. Brown suggests #Person2# pay two thousand and five hundred yuan a month at the start."
813,"#Person1# and #Person2# have the same impression on Barry and Paul, but hold different views on #Person2#'s personality.",#Person1#: I think you're shy.,Barry is a very ambitious and dishonest person. Paul is a very sociable and honest person.,"Barry and #Person1# talk about Barry's personality and his brother Paul. Barry is polite, careful, relaxed and shy. Barry is shy and he loves going out and making new friends.","#Person1# and #Person2# are talking about Barry and Paul. #Person2# thinks #Person2# is polite, careful, relaxed, and shy. #Person1# thinks #Person2# is not shy. #Person2# will be at #Person2#'s birthday party on Friday."
814,"#Person1# and #Person2# change ideas on Barry and Paul, and then talk about their own personalities.",I'm not sure what I like about Barry.,Barry is a very ambitious and dishonest person. Paul is a very sociable and honest person.,"Barry and #Person1# talk about Barry's personality and his brother Paul. Barry is polite, careful, relaxed and shy. Barry is shy and he loves going out and making new friends.","#Person1# and #Person2# are talking about Barry and Paul. #Person2# thinks #Person2# is polite, careful, relaxed, and shy. #Person1# thinks #Person2# is not shy. #Person2# will be at #Person2#'s birthday party on Friday."
815,#Person1# and #Person2# come to an agreement towards the impression of Barry and Paul but a disagreement on whether #Person2# is shy.,I'm not shy. I'm not shy. I'm not shy.,Barry is a very ambitious and dishonest person. Paul is a very sociable and honest person.,"Barry and #Person1# talk about Barry's personality and his brother Paul. Barry is polite, careful, relaxed and shy. Barry is shy and he loves going out and making new friends.","#Person1# and #Person2# are talking about Barry and Paul. #Person2# thinks #Person2# is polite, careful, relaxed, and shy. #Person1# thinks #Person2# is not shy. #Person2# will be at #Person2#'s birthday party on Friday."
816,"#Person1# is buying a house and consulting #Person2# about the location, size and surroundings.",Is there anything else I can help you with?,Contact the person you want to buy a house in.,#Person1# wants to buy a house and needs some information. #Person2# wants to stay in the ABC School District and wants to stay in the ABC School District. #Person1# will begin a search for the perfect home for #Person1#.,#Person1# is interested in buying a house and needs some information. #Person2# will begin a search for the perfect home for #Person1#.
817,#Person2# will get back to #Person1# after knowing #Person1#'s specific needs for a house.,I will begin a search for a home.,Contact the person you want to buy a house in.,#Person1# wants to buy a house and needs some information. #Person2# wants to stay in the ABC School District and wants to stay in the ABC School District. #Person1# will begin a search for the perfect home for #Person1#.,#Person1# is interested in buying a house and needs some information. #Person2# will begin a search for the perfect home for #Person1#.
818,#Person1# intends to buy a house and needs some information from #Person2#. #Person2# will call #Person2# after #Person2# finds one.,"I am looking for a house in Pasadena, California.",Contact the person you want to buy a house in.,#Person1# wants to buy a house and needs some information. #Person2# wants to stay in the ABC School District and wants to stay in the ABC School District. #Person1# will begin a search for the perfect home for #Person1#.,#Person1# is interested in buying a house and needs some information. #Person2# will begin a search for the perfect home for #Person1#.
819,#Person2# leaves the samples to Mr. Grant and will talk to him next week.,The samples were taken from the lab.,The samples are ready for you to leave.,Mr. Grant wants to leave the samples with #Person1# and will give him a call next week.,Mr. Grant asks #Person2# to leave the samples with him. #Person2# will talk to him next week.
820,#Person2# leaves Mr. Grant with samples and will call Mr. Grant later to know the decision.,"I'm glad I had a chance to see these samples, but I'm really not in a position to make a decision right now.",The samples are ready for you to leave.,Mr. Grant wants to leave the samples with #Person1# and will give him a call next week.,Mr. Grant asks #Person2# to leave the samples with him. #Person2# will talk to him next week.
821,#Person2# leaves the samples at Mr. Grant's so he can make a decision with more consideration.,Mr. Grant will leave the samples for next week.,The samples are ready for you to leave.,Mr. Grant wants to leave the samples with #Person1# and will give him a call next week.,Mr. Grant asks #Person2# to leave the samples with him. #Person2# will talk to him next week.
822,#Person2# tells #Person1# the bus route to get to Sons.,"Take the 268 going west and the 261, then get on Fair Oaks and Washington.","Take the 268 going west. Take the 261, and it'll take you to Sons.",#Person1# tells #Person2# the bus to Sons from PHS will go all the way to Sons from PHS. #Person2# tells #Person1# the bus will go all the way to Sons from PHS.,#Person1# asks #Person2# about the bus to Sons from PHS. #Person2# tells #Person1# the bus route and the bus schedule.
823,#Person2# offers bus information for #Person1# to go to Sons from PHS.,Take the 268 and turn left onto the Fair Oaks and Washington bus.,"Take the 268 going west. Take the 261, and it'll take you to Sons.",#Person1# tells #Person2# the bus to Sons from PHS will go all the way to Sons from PHS. #Person2# tells #Person1# the bus will go all the way to Sons from PHS.,#Person1# asks #Person2# about the bus to Sons from PHS. #Person2# tells #Person1# the bus route and the bus schedule.
824,#Person1# asks #Person2# the way to Sons from PHS.,You'll have to take the 268 going west to get to the Sons.,"Take the 268 going west. Take the 261, and it'll take you to Sons.",#Person1# tells #Person2# the bus to Sons from PHS will go all the way to Sons from PHS. #Person2# tells #Person1# the bus will go all the way to Sons from PHS.,#Person1# asks #Person2# about the bus to Sons from PHS. #Person2# tells #Person1# the bus route and the bus schedule.
