,human_baseline_summaries,original_model_summaries,instruct_model_summaries,peft_ia3_model_summaries,peft_lora_model_summaries
0,Ms. Dawson helps #Person1# to write a memo to inform every employee that they have to change the communication method and should not use Instant Messaging anymore.,Employees are required to take dictation breaks from their work schedules.,This memo is to be distributed to all employees by this afternoon.,#Person1# asks Ms. Dawson to take dictation for her. Ms. Dawson tells #Person1# that the use of Instant Message programs by employees during working hours is strictly prohibited. #Person1# also restricts external communications. #Person2# wants to change the communication methods and will face termination.,#Person1# asks Ms. Dawson to take a dictation for #Person1#. Ms. Dawson tells #Person1# the use of Instant Messaging is strictly prohibited and the employee will be placed on probation.
1,"In order to prevent employees from wasting time on Instant Message programs, #Person1# decides to terminate the use of those programs and asks Ms. Dawson to send out a memo to all employees by the afternoon.",Employees who use instant messaging will face a warning and a termination penalty of up to a year and a half.,This memo is to be distributed to all employees by this afternoon.,#Person1# asks Ms. Dawson to take dictation for her. Ms. Dawson tells #Person1# that the use of Instant Message programs by employees during working hours is strictly prohibited. #Person1# also restricts external communications. #Person2# wants to change the communication methods and will face termination.,#Person1# asks Ms. Dawson to take a dictation for #Person1#. Ms. Dawson tells #Person1# the use of Instant Messaging is strictly prohibited and the employee will be placed on probation.
2,Ms. Dawson takes a dictation for #Person1# about prohibiting the use of Instant Message programs in the office. They argue about its reasonability but #Person1# still insists.,IMPORTANT!,This memo is to be distributed to all employees by this afternoon.,#Person1# asks Ms. Dawson to take dictation for her. Ms. Dawson tells #Person1# that the use of Instant Message programs by employees during working hours is strictly prohibited. #Person1# also restricts external communications. #Person2# wants to change the communication methods and will face termination.,#Person1# asks Ms. Dawson to take a dictation for #Person1#. Ms. Dawson tells #Person1# the use of Instant Messaging is strictly prohibited and the employee will be placed on probation.
3,#Person2# arrives late because of traffic jam. #Person1# persuades #Person2# to use public transportations to keep healthy and to protect the environment.,I'm finally here!,Take public transport to work.,"#Person2# got stuck in traffic again. #Person2# thinks it's better to take public transport system to work. #Person2# thinks it would be better for the environment, and #Person2# thinks biking to work would be better for the environment. #Person2# thinks biking to work will give #Person2# the freedom that #Person2# has with a car.",#Person2# got stuck in traffic again. #Person1# suggests #Person2# start taking public transport system to work. #Person2# feels bad about the pollution problem in this city and suggests #Person2# start biking to work.
4,#Person2# decides to follow #Person1#'s suggestions on quitting driving to work and will try to use public transportations.,You're finally here!,Take public transport to work.,"#Person2# got stuck in traffic again. #Person2# thinks it's better to take public transport system to work. #Person2# thinks it would be better for the environment, and #Person2# thinks biking to work would be better for the environment. #Person2# thinks biking to work will give #Person2# the freedom that #Person2# has with a car.",#Person2# got stuck in traffic again. #Person1# suggests #Person2# start taking public transport system to work. #Person2# feels bad about the pollution problem in this city and suggests #Person2# start biking to work.
5,"#Person2# complains to #Person1# about the traffic jam, #Person1# suggests quitting driving and taking public transportation instead.",I'm so exhausted from the traffic jam that I'm now stuck in traffic.,Take public transport to work.,"#Person2# got stuck in traffic again. #Person2# thinks it's better to take public transport system to work. #Person2# thinks it would be better for the environment, and #Person2# thinks biking to work would be better for the environment. #Person2# thinks biking to work will give #Person2# the freedom that #Person2# has with a car.",#Person2# got stuck in traffic again. #Person1# suggests #Person2# start taking public transport system to work. #Person2# feels bad about the pollution problem in this city and suggests #Person2# start biking to work.
6,#Person1# tells Kate that Masha and Hero get divorced. Kate is surprised because she thought they are perfect couple.,"Masha and Hero are having a separation for 2 months, and are getting divorced.",Masha and Hero are getting divorced.,Kate and Hero are getting divorced. Kate tells #Person1# they are having a separation for 2 months and filed for divorce. Kate thinks they are well matched and thinks they are well matched.,#Person1# tells Kate Masha and Hero are getting divorced. Kate thinks it's surprising that they are well matched.
7,#Person1# tells Kate that Masha and Hero are getting a peaceful divorce. Kate feels surprised and asks about their kids.,"#Person1: Masha and Hero are getting divorced. #Person2: Well, I always thought they are well matched. But they are getting divorced. #Person3: Well, I always thought they are the perfect couple. #Person4: That's really surprising. I always thought they were the perfect couple.",Masha and Hero are getting divorced.,Kate and Hero are getting divorced. Kate tells #Person1# they are having a separation for 2 months and filed for divorce. Kate thinks they are well matched and thinks they are well matched.,#Person1# tells Kate Masha and Hero are getting divorced. Kate thinks it's surprising that they are well matched.
8,#Person1# and Kate talk about the divorce between Masha and Hero. Kate feels surprised because she thought they are well matched,Masha and Hero are getting divorced.,Masha and Hero are getting divorced.,Kate and Hero are getting divorced. Kate tells #Person1# they are having a separation for 2 months and filed for divorce. Kate thinks they are well matched and thinks they are well matched.,#Person1# tells Kate Masha and Hero are getting divorced. Kate thinks it's surprising that they are well matched.
9,#Person1# and Brian are at the birthday party of Brian. Brian thinks #Person1# looks great and is popular.,Brian's birthday party is coming to a conclusion.,Brian's birthday is coming up.,Brian invites Brian to a dance with him. Brian's party is a good party and Brian looks pretty today. Brian's necklace goes with his dress and #Person1# thinks Brian looks good.,Brian invites #Person1# to the party and Brian is very popular with everyone. #Person1# thinks Brian looks pretty today and wants to have a drink together.
10,#Person1# attends Brian's birthday party. Brian thinks #Person1# looks great and charming.,Brian's birthday party.,Brian's birthday is coming up.,Brian invites Brian to a dance with him. Brian's party is a good party and Brian looks pretty today. Brian's necklace goes with his dress and #Person1# thinks Brian looks good.,Brian invites #Person1# to the party and Brian is very popular with everyone. #Person1# thinks Brian looks pretty today and wants to have a drink together.
11,#Person1# has a dance with Brian at Brian's birthday party. Brian thinks #Person1# looks great and is popular.,Brian's birthday is coming up.,Brian's birthday is coming up.,Brian invites Brian to a dance with him. Brian's party is a good party and Brian looks pretty today. Brian's necklace goes with his dress and #Person1# thinks Brian looks good.,Brian invites #Person1# to the party and Brian is very popular with everyone. #Person1# thinks Brian looks pretty today and wants to have a drink together.
12,"#Person1# is surprised at the Olympic Stadium'volume, capacity and interior setting to #Person1#.",The Olympic Park is so big.,The Olympic stadium is the center of the Olympic park.,"#Person1# and #Person2# are in the Olympic stadium, the center of this park, and the whole stadium is to be finished this June. #Person1# tells #Person2# there are 5000 seats in total. #Person2# puts signs with English translations for foreign visitors.",#Person2# tells #Person1# the Olympic park is big and the stadium is to be finished this June. #Person1# thinks it's big.
13,#Person2# shows #Person1# around the constructing Olympic stadium and introduces the stadium.,The Olympic Park is so big!,The Olympic stadium is the center of the Olympic park.,"#Person1# and #Person2# are in the Olympic stadium, the center of this park, and the whole stadium is to be finished this June. #Person1# tells #Person2# there are 5000 seats in total. #Person2# puts signs with English translations for foreign visitors.",#Person2# tells #Person1# the Olympic park is big and the stadium is to be finished this June. #Person1# thinks it's big.
14,"#Person2# introduces the Olympic Stadium's finishing time, capacity and interior setting to #Person1#.",The Olympic stadium is a huge space with a lot of seats.,The Olympic stadium is the center of the Olympic park.,"#Person1# and #Person2# are in the Olympic stadium, the center of this park, and the whole stadium is to be finished this June. #Person1# tells #Person2# there are 5000 seats in total. #Person2# puts signs with English translations for foreign visitors.",#Person2# tells #Person1# the Olympic park is big and the stadium is to be finished this June. #Person1# thinks it's big.
15,"#Person1# wants to create a company and is going to write a business plan. #Person2# gives #Person1# suggestions on how to summarise business ideas, describe the service, differ from competitors and attract investment in a good business plan. #Person1# decides to stick to the old job.",Write a business plan.,Write a business plan. Write a market analysis. Write a strategy.,#Person1# wants to create a business plan and wants to explain the business plan and the business plan. #Person1# tells #Person2# the most important piece of information for #Person1#'s investors is the financial analysis. #Person1# thinks #Person1# will stick to #Person2#'s old job and save #Person1# all the hassle of trying to start up a business.,#Person1# is done working for a company that is taking #Person1# nowhere. #Person2# tells #Person1# that #Person1# will write up a business plan and get some investors. #Person1# thinks #Person1# will stick to #Person1#'s old job and save #Person1# all the hassle of starting up a business.
16,"#Person1# abandons the idea of creating a company after #Person2# explains what a business plan includes. #Person2# specifies that a well-written business plan includes an executive summary, goods and service description, strategy and implementation, and financial analysis.","#Person1: I'm done working for a company that is taking me nowhere! #Person2: Well, I've been working for a company that is taking me nowhere! #Person1: I'm done! I'm going to write a business plan and get some investors to help me! #Person1: I'm going to write a business plan and get some investors!",Write a business plan. Write a market analysis. Write a strategy.,#Person1# wants to create a business plan and wants to explain the business plan and the business plan. #Person1# tells #Person2# the most important piece of information for #Person1#'s investors is the financial analysis. #Person1# thinks #Person1# will stick to #Person2#'s old job and save #Person1# all the hassle of trying to start up a business.,#Person1# is done working for a company that is taking #Person1# nowhere. #Person2# tells #Person1# that #Person1# will write up a business plan and get some investors. #Person1# thinks #Person1# will stick to #Person1#'s old job and save #Person1# all the hassle of starting up a business.
17,"#Person1# wants to start #Person1#'s own business, but #Person2# warns #Person1# of the hassle. #Person2# tells #Person1# what is needed in a business plan and #Person1# decides to stick to the old job for now.",Write a business plan.,Write a business plan. Write a market analysis. Write a strategy.,#Person1# wants to create a business plan and wants to explain the business plan and the business plan. #Person1# tells #Person2# the most important piece of information for #Person1#'s investors is the financial analysis. #Person1# thinks #Person1# will stick to #Person2#'s old job and save #Person1# all the hassle of trying to start up a business.,#Person1# is done working for a company that is taking #Person1# nowhere. #Person2# tells #Person1# that #Person1# will write up a business plan and get some investors. #Person1# thinks #Person1# will stick to #Person1#'s old job and save #Person1# all the hassle of starting up a business.
18,#Person2# feels itchy. #Person1# doubts it is chicken pox and asks #Person2# to get away. #Person2# doesn't believe it.,#Pretty____________________________________________________________________________________________________________________________________________________________________________________________________,Get a medical checkup.,#Person2# feels itchy and feels lightheaded. #Person1# tells #Person2# #Person2# has chicken pox and #Person2# thinks #Person2# is contagious. #Person2# thinks #Person2# is a biohazard and will go take an oatmeal bath.,#Person2# feels itchy and feels lightheaded and weak. #Person1# thinks #Person2# has chicken pox and #Person2# is a biohazard. #Person2# thinks #Person2# is a biohazard.
19,#Person1# suspects that #Person2# has chicken pox and wants to keep away from #Person2#. #Person2# thinks #Person1# is exaggerating.,Is it a chicken pox or an allergy?,Get a medical checkup.,#Person2# feels itchy and feels lightheaded. #Person1# tells #Person2# #Person2# has chicken pox and #Person2# thinks #Person2# is contagious. #Person2# thinks #Person2# is a biohazard and will go take an oatmeal bath.,#Person2# feels itchy and feels lightheaded and weak. #Person1# thinks #Person2# has chicken pox and #Person2# is a biohazard. #Person2# thinks #Person2# is a biohazard.
20,#Person1# thinks #Person2# has chicken pox and warns #Person2# about the possible hazards but #Person2# thinks it will be fine.,Is it a fluke?,Get a medical checkup.,#Person2# feels itchy and feels lightheaded. #Person1# tells #Person2# #Person2# has chicken pox and #Person2# thinks #Person2# is contagious. #Person2# thinks #Person2# is a biohazard and will go take an oatmeal bath.,#Person2# feels itchy and feels lightheaded and weak. #Person1# thinks #Person2# has chicken pox and #Person2# is a biohazard. #Person2# thinks #Person2# is a biohazard.
21,#Person2# is checking out and asks #Person1# for the bill. #Person1# gives #Person2# a wrong bill at first then corrects it.,The bill for the laundry service is due today.,I'm in Room 309. I'm checking out today. Can I have your laundry service charge now?,#Person2# checks out today and asks #Person1# to check out. #Person2#'s laundry service is not included in the bill. #Person1# apologizes and will correct the bill.,#Person2# is checking out today and #Person1# tells #Person2# the charge for #Person2#'s laundry service on Nov. 20th has been a mistake. #Person1# will correct the bill.
22,#Person1# helps #Person2# correct a mischarged bill on laundry service and helps #Person2# check out.,The charge for your laundry service is 30 dollars.,I'm in Room 309. I'm checking out today. Can I have your laundry service charge now?,#Person2# checks out today and asks #Person1# to check out. #Person2#'s laundry service is not included in the bill. #Person1# apologizes and will correct the bill.,#Person2# is checking out today and #Person1# tells #Person2# the charge for #Person2#'s laundry service on Nov. 20th has been a mistake. #Person1# will correct the bill.
23,#Person2# finds #Person2# being mischarged. #Person1# corrects the bill and #Person2# pays for it.,The laundry charge for Nov. 20th is $17.,I'm in Room 309. I'm checking out today. Can I have your laundry service charge now?,#Person2# checks out today and asks #Person1# to check out. #Person2#'s laundry service is not included in the bill. #Person1# apologizes and will correct the bill.,#Person2# is checking out today and #Person1# tells #Person2# the charge for #Person2#'s laundry service on Nov. 20th has been a mistake. #Person1# will correct the bill.
24,#Person1# is begging Steven to persuade his wife not to divorce him. Steven agrees.,I'm sorry to hear that you cheat on your wife.,I need your help.,Steven tells #Person1# his wife has an affair with his secretary and is going to divorce him. Steven promises to persuade her to reconsider the divorce.,Steven tells #Person1# #Person1# has an affair with his secretary and is going to divorce #Person1#. #Person1# swears that the affair lasts only for two months. Steven will try to persuade her to reconsider the divorce.
25,Steve will try to persuade #Person1#'s wife not to divorce #Person1# as #Person1# swears to remain faithful forever.,Steven: I need your help.,I need your help.,Steven tells #Person1# his wife has an affair with his secretary and is going to divorce him. Steven promises to persuade her to reconsider the divorce.,Steven tells #Person1# #Person1# has an affair with his secretary and is going to divorce #Person1#. #Person1# swears that the affair lasts only for two months. Steven will try to persuade her to reconsider the divorce.
26,"#Person1# begs Steven's to persuade #Person1#'s wife not to divorce him, and Steven agrees.","Steven, please help me.",I need your help.,Steven tells #Person1# his wife has an affair with his secretary and is going to divorce him. Steven promises to persuade her to reconsider the divorce.,Steven tells #Person1# #Person1# has an affair with his secretary and is going to divorce #Person1#. #Person1# swears that the affair lasts only for two months. Steven will try to persuade her to reconsider the divorce.
27,#Person1# and #Person2# are talking about Abraham Lincoln. They think he was a noble man.,#Person1#: I think of Abraham Lincoln. #Person2#: I think of Abraham Lincoln. #Person2#: I think of Abraham Lincoln. #Person2#: I think of Abraham Lincoln. #Person1#: I think of Abraham Lincoln. #Person2#: I think of Abraham Lincoln. #Person1#: I think of Abraham Lincoln. #Person2#: I think of Abraham Lincoln. #Person1#: I think of Abraham Lincoln. #Person1#: I think of Abraham Lincoln. #Person2#: I think of Abraham Lincoln. #Person1#: I think of Abraham Lincoln. #Person1#: I think of Abraham Lincoln.,I think Abraham Lincoln is a great man.,#Person2# thinks Abraham Lincoln is a man or woman of sound character. #Person1# thinks Abraham Lincoln was famous for never giving up on his goals. #Person2# admires Abraham Lincoln for his courage in fighting for equal rights.,#Person2# thinks Abraham Lincoln is a man or woman of sound character and admires him for his courage and humility.
28,"#Person2# admires Abraham Lincoln for his perseverance, courage and humility.",I think the US President was famous for his courage and his determination.,I think Abraham Lincoln is a great man.,#Person2# thinks Abraham Lincoln is a man or woman of sound character. #Person1# thinks Abraham Lincoln was famous for never giving up on his goals. #Person2# admires Abraham Lincoln for his courage in fighting for equal rights.,#Person2# thinks Abraham Lincoln is a man or woman of sound character and admires him for his courage and humility.
29,#Person1# and #Person2# talk about Abraham Lincoln and his glorious history. They both admire him.,"The President of the United States was famous for his philandering, philanthropic, and philanthropy.",I think Abraham Lincoln is a great man.,#Person2# thinks Abraham Lincoln is a man or woman of sound character. #Person1# thinks Abraham Lincoln was famous for never giving up on his goals. #Person2# admires Abraham Lincoln for his courage in fighting for equal rights.,#Person2# thinks Abraham Lincoln is a man or woman of sound character and admires him for his courage and humility.
30,#Person2# plans to have a trip in Hebei but #Person1# says there are sandstorms in there.,The sandstorms are a common cause of respiratory tract infections.,The sandstorms in China are causing a lot of health problems.,#Person2# tells #Person1# that China is experiencing severe sandstorms and the North of China is experiencing severe sandstorms. #Person1# thinks the sandstorms are trouble for everybody.,#Person2# tells #Person1# the north of China is experiencing severe sandstorms. #Person1# tells #Person2# the number of people with respiratory tract infections tended to rise after sandstorms.
31,#Person1# tells #Person2# Hebei was experiencing severe sandstorms and sandstorms threaten people's health.,The report said that the number of respiratory tract infections tended to increase after sandstorms.,The sandstorms in China are causing a lot of health problems.,#Person2# tells #Person1# that China is experiencing severe sandstorms and the North of China is experiencing severe sandstorms. #Person1# thinks the sandstorms are trouble for everybody.,#Person2# tells #Person1# the north of China is experiencing severe sandstorms. #Person1# tells #Person2# the number of people with respiratory tract infections tended to rise after sandstorms.
32,#Person2# wants to travel to Hebei but #Person1# informs #Person2# of terrible sandstorms there.,I'm going to Hebei.,The sandstorms in China are causing a lot of health problems.,#Person2# tells #Person1# that China is experiencing severe sandstorms and the North of China is experiencing severe sandstorms. #Person1# thinks the sandstorms are trouble for everybody.,#Person2# tells #Person1# the north of China is experiencing severe sandstorms. #Person1# tells #Person2# the number of people with respiratory tract infections tended to rise after sandstorms.
33,#Person2# comes to the birthday party of Francis and sends him a remote car model.,The birthday party is now over.,The gift is for Francis's birthday.,Francis presents Francis a remote car model and his favorite brand. Francis is happy to open it now. Francis is happy to give Francis a nice little car.,Francis is celebrating his birthday with a remote car model and his favorite brand. #Person2# is happy to give Francis a nice little car.
34,#Person2# gives Francis a car model that both of them love as a birthday gift.,#Person1: Thank you for inviting me. #Person2: Thank you for inviting me. #Person1: Thank you for inviting me. #Person2: Thank you for inviting me. #Person1: Thank you for inviting me. #Person2: Thank you for coming to my birthday party.,The gift is for Francis's birthday.,Francis presents Francis a remote car model and his favorite brand. Francis is happy to open it now. Francis is happy to give Francis a nice little car.,Francis is celebrating his birthday with a remote car model and his favorite brand. #Person2# is happy to give Francis a nice little car.
35,#Person2# gives Francis a nice car model as a birthday gift and Francis appreciates it.,Thank you for inviting me to your birthday party.,The gift is for Francis's birthday.,Francis presents Francis a remote car model and his favorite brand. Francis is happy to open it now. Francis is happy to give Francis a nice little car.,Francis is celebrating his birthday with a remote car model and his favorite brand. #Person2# is happy to give Francis a nice little car.
36,Tony got caught cheating and feels ashamed. Steven tells him to learn from it and study hard.,"Steven, you look a lot like Steven.","Hi, Steven.",Steven feels ashamed because he got caught cheating. Steven tells #Person1# he should study hard.,Tony tells Steven he got caught cheating and he feels ashamed. Steven advises Tony to study hard.
37,Tony tells Steven that he failed a class because of cheating and he feels awful.,The teacher caught Tony cheating and told him he had to do it.,"Hi, Steven.",Steven feels ashamed because he got caught cheating. Steven tells #Person1# he should study hard.,Tony tells Steven he got caught cheating and he feels ashamed. Steven advises Tony to study hard.
38,Tony tells Steven that he cheated on the exam and realized his mistake.,The teacher caught Tony cheating.,"Hi, Steven.",Steven feels ashamed because he got caught cheating. Steven tells #Person1# he should study hard.,Tony tells Steven he got caught cheating and he feels ashamed. Steven advises Tony to study hard.
39,#Person1# is catching a train. Tom asks #Person1# not to hurry.,"The train is about to start, but the train station is too far.",The train is about to leave.,Tom tells #Person1# he must catch the nine-thirty train. Tom tells Tom he has plenty of time yet.,Tom tells #Person1# it's late and #Person1# must catch the nine-thirty train.
40,#Person1# is in a hurry to catch a train. Tom tells #Person1# there is plenty of time.,The train is late.,The train is about to leave.,Tom tells #Person1# he must catch the nine-thirty train. Tom tells Tom he has plenty of time yet.,Tom tells #Person1# it's late and #Person1# must catch the nine-thirty train.
41,#Person1# is rushing to catch a train but Tom thinks it isn't necessary.,The train is leaving at nine thirty.,The train is about to leave.,Tom tells #Person1# he must catch the nine-thirty train. Tom tells Tom he has plenty of time yet.,Tom tells #Person1# it's late and #Person1# must catch the nine-thirty train.
